{
  "schemaVersion": 1,
  "kind": "environment",
  "runID": "11111111-1111-4111-8111-111111111111",
  "capturedAt": "2026-07-23T15:00:00Z",
  "repository": {
    "commit": "working-tree",
    "dirty": true
  },
  "platform": {
    "osVersion": "26.5.2",
    "architecture": "arm64",
    "modelIdentifier": "Mac16,7",
    "unifiedMemoryBytes": 51539607552
  },
  "toolchain": {
    "xcodeVersion": "26.6",
    "swiftVersion": "6.3.3",
    "xcodegenVersion": "2.45.3"
  },
  "privacy": {
    "telemetryEnabled": false,
    "networkPolicy": "deny-all"
  }
}
